{
  "$schema": "../game-started.json",

  "type": "GAME_STARTED",
  "senderId": "GAME_MASTER",
  "recipientId": "123e4567-e89b-12d3-a456-426655440000",
  "payload": {
    "teamInfo": {
      "1": {
        "players": ["123e4567-e89b-12d3-a456-426655440000", "223e4567-e89b-12d3-a456-426655440000"],
        "leaderId": "123e4567-e89b-12d3-a456-426655440000"
      },
      "2": {
        "players": ["323e4567-e89b-12d3-a456-426655440000", "423e4567-e89b-12d3-a456-426655440000"],
        "leaderId": "323e4567-e89b-12d3-a456-426655440000"
      }
    }
  }
}
